{
  "request_id": "live_registry_bridge_001",
  "subject_commitment": "0x0707070707070707070707070707070707070707070707070707070707070707",
  "claim_type": "kyc",
  "jurisdiction": "BR",
  "attestation_root": "0x0909090909090909090909090909090909090909090909090909090909090909",
  "note_public_key": "0x3333333333333333333333333333333333333333333333333333333333333333",
  "membership_blinding": "555555555",
  "target_network": "testnet",
  "membership_contract_id": "CBULZZIAHWL33XD5OBL2LBPYSFBYCNCOCIJITGJ74OSRRA7IZKIUBTKN",
  "non_membership_contract_id": "CDREZXZILERCSD7VMS4SKVRQY4FNIYJCTYA2AY4TKFRV6Y3L3M2OK3O3",
  "operator_mode": "prepared",
  "prepared_by": "hermes",
  "registry_contract_id": "CAUDSMRKMZPZNCVHJZ3JFYVV2ZNK7TC7MFZCJNN75QUBZ2W4AYTEWTYP",
  "issuer": "GDJSDCHTRQYZNKJMUFZ76NAIZ3ZNMBWWAPQ5UHI3JUSOFPSB7NEGQ6UN",
  "valid_until": 0,
  "policy_min_trust_tier": 2,
  "policy_min_stake": 1000,
  "decision_source": "live-protocol-registry-testnet",
  "decision_provenance": {
    "extracted_from_live_registry": true,
    "source_account": "dpo2u-deployer",
    "network": "testnet"
  }
}
